{
  "id": "Palms-Down_Dumbbell_Wrist_Curl_Over_A_Bench",
  "locale": "ru",
  "name": "Сгибание запястий с гантелями ладонями вниз на скамье",
  "aliases": [
    "Palms-Down Dumbbell Wrist Curl Over A Bench",
    "Сгибание запястий с гантелями ладонями вниз",
    "гантели",
    "предплечья"
  ],
  "review_status": "machine_draft",
  "reviewed_at": null,
  "reviewed_by": null
}
