{
  "id": "Supine_Two-Arm_Overhead_Throw",
  "locale": "ru",
  "name": "Бросок над головой двумя руками лёжа",
  "aliases": [
    "Supine Two-Arm Overhead Throw",
    "Бросок над головой двумя руками лежа",
    "Бросок над головой",
    "медицинбол",
    "пресс"
  ],
  "review_status": "machine_draft",
  "reviewed_at": null,
  "reviewed_by": null
}
