{
  "id": "Lying_Face_Down_Plate_Neck_Resistance",
  "locale": "ru",
  "name": "Подъём головы с диском лёжа на животе",
  "aliases": [
    "Lying Face Down Plate Neck Resistance",
    "Подъем головы с диском лежа на животе",
    "шея"
  ],
  "review_status": "machine_draft",
  "reviewed_at": null,
  "reviewed_by": null
}
