{
  "id": "Smith_Machine_Decline_Press",
  "locale": "ru",
  "name": "В тренажёре Смитта на скамье вниз головой жим",
  "aliases": [
    "Smith Machine Decline Press",
    "В тренажере Смитта на скамье вниз головой жим",
    "жим",
    "тренажёр",
    "грудные"
  ],
  "review_status": "machine_draft",
  "reviewed_at": null,
  "reviewed_by": null
}
