{
  "id": "Standing_Gastrocnemius_Calf_Stretch",
  "locale": "ru",
  "name": "Растяжка икроножной мышцы стоя",
  "aliases": [
    "Standing Gastrocnemius Calf Stretch",
    "Растяжка икроножной мышцы",
    "растяжка",
    "икры"
  ],
  "review_status": "machine_draft",
  "reviewed_at": null,
  "reviewed_by": null
}
