{
  "id": "Dumbbell_One-Arm_Triceps_Extension",
  "locale": "ru",
  "name": "Разгибание руки с гантелью на трицепс одной рукой",
  "aliases": [
    "Dumbbell One-Arm Triceps Extension",
    "Разгибание руки с гантелью на трицепс",
    "трицепс",
    "гантели"
  ],
  "review_status": "machine_draft",
  "reviewed_at": null,
  "reviewed_by": null
}
