{
  "id": "Incline_Push-Up_Close-Grip",
  "locale": "ru",
  "name": "Отжимания узким хватом на наклонной скамье",
  "aliases": [
    "Incline Push-Up Close-Grip",
    "отжимания",
    "жим",
    "собственный вес",
    "трицепс"
  ],
  "review_status": "machine_draft",
  "reviewed_at": null,
  "reviewed_by": null
}
