{
  "id": "Hang_Clean_-_Below_the_Knees",
  "locale": "ru",
  "name": "Взятие на грудь с виса ниже коленей",
  "aliases": [
    "Hang Clean - Below the Knees",
    "взятие на грудь",
    "штанга",
    "квадрицепс"
  ],
  "review_status": "machine_draft",
  "reviewed_at": null,
  "reviewed_by": null
}
