{
  "id": "Tricep_Dumbbell_Kickback",
  "locale": "ru",
  "name": "Трицепс гантель кикбэк (разгибание руки в наклоне)",
  "aliases": [
    "Tricep Dumbbell Kickback",
    "Трицепс гантель кикбэк",
    "трицепс",
    "гантели"
  ],
  "review_status": "machine_draft",
  "reviewed_at": null,
  "reviewed_by": null
}
