{
  "id": "Standing_One-Arm_Dumbbell_Triceps_Extension",
  "locale": "ru",
  "name": "Разгибание руки с гантелью на трицепс одной рукой стоя",
  "aliases": [
    "Standing One-Arm Dumbbell Triceps Extension",
    "Разгибание руки с гантелью на трицепс",
    "трицепс",
    "гантели"
  ],
  "review_status": "machine_draft",
  "reviewed_at": null,
  "reviewed_by": null
}
