{
  "id": "Power_Partials",
  "locale": "ru",
  "name": "Частичные подъёмы в стороны (power partials)",
  "aliases": [
    "Power Partials",
    "Частичные подъемы в стороны (power partials)",
    "Частичные подъёмы в стороны",
    "гантели",
    "дельты"
  ],
  "review_status": "machine_draft",
  "reviewed_at": null,
  "reviewed_by": null
}
