{
  "id": "Close-Grip_EZ-Bar_Curl_with_Band",
  "locale": "ru",
  "name": "Сгибания с EZ-грифом узким хватом с эспандером",
  "aliases": [
    "Close-Grip EZ-Bar Curl with Band",
    "Сгибания с EZ-грифом узким хватом",
    "EZ-гриф",
    "бицепс"
  ],
  "review_status": "machine_draft",
  "reviewed_at": null,
  "reviewed_by": null
}
