{
  "id": "Lying_Bent_Leg_Groin",
  "locale": "ru",
  "name": "Растяжка приводящих лёжа с согнутой ногой",
  "aliases": [
    "Lying Bent Leg Groin",
    "Растяжка приводящих лежа с согнутой ногой",
    "растяжка",
    "приводящие"
  ],
  "review_status": "machine_draft",
  "reviewed_at": null,
  "reviewed_by": null
}
