{
  "id": "One-Arm_High-Pulley_Cable_Side_Bends",
  "locale": "ru",
  "name": "Наклоны в сторону на верхнем блоке одной рукой",
  "aliases": [
    "One-Arm High-Pulley Cable Side Bends",
    "Наклоны в сторону на верхнем блоке",
    "блок",
    "пресс"
  ],
  "review_status": "machine_draft",
  "reviewed_at": null,
  "reviewed_by": null
}
