{
  "id": "Kettlebell_Halo_With_Overhead_Extension",
  "locale": "ru",
  "name": "«Хало» с гирей и разгибанием над головой",
  "aliases": [
    "Kettlebell Halo with Overhead Extension",
    "дельты",
    "трицепс"
  ],
  "review_status": "machine_draft",
  "reviewed_at": null,
  "reviewed_by": null
}
