{
  "id": "One_Arm_Dumbbell_Bench_Press",
  "locale": "ru",
  "name": "Жим гантелей лёжа одной рукой",
  "aliases": [
    "One Arm Dumbbell Bench Press",
    "Жим гантелей лежа одной рукой",
    "Жим гантелей",
    "жим гантелей",
    "жим",
    "гантели",
    "грудные"
  ],
  "review_status": "machine_draft",
  "reviewed_at": null,
  "reviewed_by": null
}
