{
  "id": "Bicycling",
  "locale": "ru",
  "name": "Велосипед",
  "aliases": [
    "Bicycling",
    "квадрицепс"
  ],
  "review_status": "machine_draft",
  "reviewed_at": null,
  "reviewed_by": null,
  "instructions_ru": [
    "Для начала сядьте на велотренажёр и отрегулируйте седло под свой рост."
  ]
}
