{
  "id": "Upright_Row_-_With_Bands",
  "locale": "ru",
  "name": "Тяга к подбородку с эспандером",
  "aliases": [
    "Upright Row - With Bands",
    "Тяга к подбородку",
    "тяга блока",
    "тяга",
    "эспандер",
    "трапеции"
  ],
  "review_status": "machine_draft",
  "reviewed_at": null,
  "reviewed_by": null
}
