{
  "id": "One_Arm_Pronated_Dumbbell_Triceps_Extension",
  "locale": "ru",
  "name": "Разгибание руки с гантелью на трицепс пронированным хватом одной рукой",
  "aliases": [
    "One Arm Pronated Dumbbell Triceps Extension",
    "Разгибание руки с гантелью на трицепс пронированным хватом",
    "трицепс",
    "гантели"
  ],
  "review_status": "machine_draft",
  "reviewed_at": null,
  "reviewed_by": null
}
