{
  "id": "Triceps_Pushdown_-_V-Bar_Attachment",
  "locale": "ru",
  "name": "Разгибания на блоке с V-рукоятью",
  "aliases": [
    "Triceps Pushdown - V-Bar Attachment",
    "Разгибания",
    "тяга блока",
    "блок",
    "трицепс"
  ],
  "review_status": "machine_draft",
  "reviewed_at": null,
  "reviewed_by": null
}
