{
  "id": "Wide_Stance_Barbell_Squat",
  "locale": "ru",
  "name": "Приседания со штангой широкой постановкой",
  "aliases": [
    "Wide Stance Barbell Squat",
    "приседания",
    "присед",
    "штанга",
    "квадрицепс"
  ],
  "review_status": "machine_draft",
  "reviewed_at": null,
  "reviewed_by": null
}
