{
  "id": "Sumo_Deadlift",
  "locale": "ru",
  "name": "Становая тяга сумо",
  "aliases": [
    "Sumo Deadlift",
    "становая тяга",
    "становая",
    "тяга",
    "штанга",
    "бицепс бедра",
    "становая сумо"
  ],
  "review_status": "machine_draft",
  "reviewed_at": null,
  "reviewed_by": null,
  "instructions_ru": [
    "Начните со штангой на полу. Подойдите так, чтобы гриф пересекал середину стоп. Стопы очень широко, почти к втулкам. Наклонитесь в тазобедренных суставах, чтобы взяться за гриф. Руки прямо под плечами, внутри ног; хват прямой, разнохват или «замок». Расслабьте плечи — это удлиняет руки.",
    "Сделайте вдох, затем опустите таз, глядя вперёд и держа грудь поднятой. Оттолкнитесь от пола, разводя стопы, с весом на задней половине стоп. Разгибайтесь в тазобедренных суставах и коленях.",
    "Когда гриф пройдёт колени, отклонитесь назад и подайте таз к грифу, сводя лопатки.",
    "Верните вес на пол, наклоняясь в тазобедренных суставах и контролируя опускание."
  ]
}
