{
  "id": "Seated_Dumbbell_Palms-Down_Wrist_Curl",
  "locale": "ru",
  "name": "Сгибание запястий с гантелями ладонями вниз сидя",
  "aliases": [
    "Seated Dumbbell Palms-Down Wrist Curl",
    "Сгибание запястий с гантелями ладонями вниз",
    "гантели",
    "предплечья"
  ],
  "review_status": "machine_draft",
  "reviewed_at": null,
  "reviewed_by": null
}
